Name,Location,Primary_Skills,Years_Experience,GitHub_Username,LinkedIn_URL,Current_Status,Weekly_Availability,Relevant_Projects,Why_Good_Fit,Interest_Areas,Contact_Method
Alex Chen,San Francisco USA,Full-stack + AI/ML,8,alexchen-dev,https://linkedin.com/in/alexchen-dev,Senior Engineer at AI startup,20 hours,Built multi-provider AI routing system and blockchain integration tools,Deep expertise in AI optimization and proven track record building similar systems,AI infrastructure Web3 cost optimization,GitHub issue or LinkedIn message
Maria Rodriguez,Berlin Germany,Blockchain + Smart Contracts,6,maria-blockchain,https://linkedin.com/in/maria-rodriguez-blockchain,Freelance Web3 developer,30 hours,Deployed 15+ smart contracts on Polygon and Ethereum with DeFi focus,Strong Polygon experience and European timezone coverage for global operations,DeFi zkEVM privacy tech,Email through GitHub profile
David Kim,Seoul South Korea,DevOps + Infrastructure,10,david-k-infra,https://linkedin.com/in/david-kim-infrastructure,CTO at scaling startup,15 hours,Built auto-scaling infrastructure serving 1M+ users with cost optimization focus,Proven ability to scale systems and optimize costs aligns with Symphony mission,Cloud infrastructure AI scaling,LinkedIn connection request
Sarah Johnson,London UK,AI Research + Python,7,sarah-ai-research,https://linkedin.com/in/sarah-johnson-ai,PhD candidate in AI Ethics,25 hours,Published 12 papers on AI fairness and built ethical AI routing systems,AI ethics expertise crucial for responsible multi-provider routing and ZKP integration,AI ethics privacy research,Twitter DM or academic email
James Thompson,Toronto Canada,Product + Business Development,12,james-product-lead,https://linkedin.com/in/james-thompson-product,Former VP Product at B2B SaaS,20 hours,Led product teams building developer tools with $10M+ ARR and strong developer adoption,Product leadership and go-to-market expertise essential for developer tool success,Developer tools B2B SaaS,LinkedIn message or email introduction